{
  "$schema": "http://json-schema.org/draft-07/schema#",
  "title": "harness config",
  "description": "프로젝트 고유 지식이 사는 유일한 파일. 스크립트·페이즈 파일에는 고유명사를 남기지 않는다. scripts/harness.py 의 자체 검증기가 이 스키마를 해석하므로 아래 키워드만 쓴다: type · enum · required · properties · additionalProperties · items · minItems · minimum · maximum · pattern · $ref(로컬) · definitions · title · description. 인스턴스에서 밑줄(_)로 시작하는 키는 주석으로 보고 additionalProperties 검사에서 제외한다.",
  "type": "object",
  "required": ["schema", "project", "adapter", "contract", "vcs", "roles", "primary_role"],
  "additionalProperties": false,
  "properties": {
    "schema": {
      "description": "config 형식 버전. 형식이 깨지는 변경을 할 때만 올린다.",
      "type": "integer",
      "enum": [1]
    },
    "project": {
      "type": "object",
      "required": ["name", "language", "instruction_file"],
      "additionalProperties": false,
      "properties": {
        "name": {"type": "string", "pattern": "^[a-z0-9][a-z0-9-]*$"},
        "language": {
          "description": "생성물(보고서·PR 본문·에스컬레이션)의 언어. 파서는 어느 언어에서도 헤딩 텍스트에 의존하지 않는다.",
          "type": "string",
          "enum": ["ko", "en"]
        },
        "instruction_file": {"type": "string"},
        "instruction_slot_budget": {
          "description": "instruction_file 에 산문 규칙을 몇 칸까지 둘 수 있는가. 기계로 막을 수 있는 규칙의 산문 승격을 막는 예산.",
          "type": "integer",
          "minimum": 0
        },
        "rules_dir": {"type": "string"},
        "secret_files": {"type": "array", "items": {"type": "string"}},
        "source_inject_max_chars": {
          "description": "steps[].sources 로 프롬프트에 실을 소스 파일 합계의 상한(문자). 접두부는 모든 turn 에 곱해지므로 상한 없는 첨부는 개선이 아니라 악화다. 기본 60000.",
          "type": "integer", "minimum": 1
        },
        "guardrail_docs": {
          "description": "프롬프트에 주입할 docs/ 문서(확장자 없는 파일명)의 phase 기본값. 미지정이면 전량 주입하되 실행기가 미선택으로 드러낸다. step 이 steps[].docs 로 덮어쓴다.",
          "type": "array", "items": {"type": "string"}
        }
      }
    },
    "adapter": {
      "description": "harness/adapters/{id}.json 의 id.",
      "type": "string",
      "pattern": "^[a-z0-9][a-z0-9-]*$"
    },
    "contract": {
      "type": "object",
      "required": ["path_template", "sections", "required"],
      "additionalProperties": false,
      "properties": {
        "path_template": {"type": "string"},
        "sections": {
          "description": "계약 문서의 절 제목. 파서 계약이지만 제목 자체는 프로젝트의 언어·어휘에 속한다. harness/templates/contract.md 와 일치해야 하고 doctor 가 그 일치를 검사한다.",
          "type": "object",
          "required": ["units", "entrypoints", "errors"],
          "additionalProperties": false,
          "properties": {
            "units": {"type": "string"},
            "entrypoints": {"type": "string"},
            "errors": {"type": "string"},
            "data_shapes": {"type": "string"},
            "schema": {"type": "string"},
            "boundaries": {"type": "string"}
          }
        },
        "required": {
          "description": "계약 문서에 반드시 있어야 하는 절의 키.",
          "type": "array",
          "minItems": 1,
          "items": {"type": "string", "enum": ["units", "entrypoints", "errors", "data_shapes", "schema", "boundaries"]}
        }
      }
    },
    "vcs": {
      "type": "object",
      "required": ["forge", "remote", "base_branch", "branch_pattern"],
      "additionalProperties": false,
      "properties": {
        "forge": {"type": "string", "enum": ["github"]},
        "remote": {"type": "string"},
        "base_branch": {"type": "string"},
        "branch_pattern": {"type": "string"},
        "protected": {"type": "array", "items": {"type": "string"}},
        "pr_template": {"type": "string"}
      }
    },
    "roles": {
      "description": "N인. 2인 고정이 아니다. owns 에서 excludes 를 뺀 실효 집합이 서로 겹치면 doctor 가 거부한다.",
      "type": "array",
      "minItems": 1,
      "items": {"$ref": "#/definitions/role"}
    },
    "primary_role": {
      "description": "귀속이 ambiguous 일 때의 시작점. roles[].id 중 하나여야 한다.",
      "type": "string"
    },
    "main_owned_paths": {
      "description": "메인 에이전트 단독 소유. 워커가 만지지 않는다 — 하네스 자신·문서·설정.",
      "type": "array",
      "items": {"type": "string"}
    },
    "budget": {
      "type": "object",
      "additionalProperties": false,
      "properties": {
        "files_max": {"type": "integer", "minimum": 1},
        "lines_max": {"type": "integer", "minimum": 1},
        "model_calls_max": {"type": "integer", "minimum": 1}
      }
    },
    "profile": {
      "type": "object",
      "additionalProperties": false,
      "properties": {
        "small_max_units": {"type": "integer", "minimum": 1},
        "inv_skip_below_chars": {"type": "integer", "minimum": 0}
      }
    },
    "reviewers": {
      "description": "05-code-review 의 리뷰어 목록. when glob 이 변경 파일에 걸리면 켜지고, 우선순위는 배열 순서다. skill 은 .claude/skills/{skill}/SKILL.md 를 가리키며 doctor 와 lint-phases 가 기동 전에 실재를 확인한다 — 없는 스킬을 부르면 05 가 라운드마다 헛돈다. roles[].agent 와 겹치는 skill 은 거부한다: 작성자가 자기 코드를 리뷰한 것은 독립 관측이 아니다.",
      "type": "array",
      "items": {
        "type": "object",
        "additionalProperties": false,
        "required": ["code", "skill", "when"],
        "properties": {
          "code": {
            "description": "산출물 파일명에 쓰는 축약. 경로 240자 상한이 있어 짧게 쓴다.",
            "type": "string",
            "pattern": "^[a-z][a-z0-9-]*$"
          },
          "skill": {
            "description": ".claude/skills/{skill}/SKILL.md 의 디렉터리 이름.",
            "type": "string"
          },
          "priority": {"type": "integer", "minimum": 1},
          "when": {
            "description": "변경 파일 경로에 매칭할 glob. 하나라도 걸리면 켜진다.",
            "type": "array",
            "minItems": 1,
            "items": {"type": "string"}
          },
          "only_when_no_source_change": {
            "description": "참이면 소스 변경이 하나도 없는 런에서만 켜진다.",
            "type": "boolean"
          }
        }
      }
    },
    "review": {
      "description": "05 의 상한과 모드 전환점. **여기 값은 전부 미검증 상속값이다** — 원본 명세에서 왔고 이 리포에서 재본 적이 없다. 첫 세 런의 원장이 이 값을 검사한다.",
      "type": "object",
      "additionalProperties": false,
      "properties": {
        "merge_below_diff_lines": {
          "description": "이 줄 수 이하이면 통합 모드 — 단일 에이전트가 체크리스트를 순차 적용한다. 같은 diff 를 여러 번 보내지 않는다.",
          "type": "integer", "minimum": 1
        },
        "profile_caps": {
          "type": "object",
          "additionalProperties": false,
          "properties": {
            "small": {"type": "integer", "minimum": 1},
            "normal": {"type": "integer", "minimum": 1}
          }
        },
        "findings_max": {
          "description": "넘으면 Critical/Major 만 남기고 절단하되 truncated 로 드러낸다.",
          "type": "integer", "minimum": 1
        },
        "inline_max": {
          "description": "리뷰어에게 인라인으로 싣는 diff 의 상한. 넘으면 경로 전달로 폴백하고 그 사실을 원장에 남긴다.",
          "type": "object",
          "additionalProperties": false,
          "properties": {
            "lines": {"type": "integer", "minimum": 1},
            "bytes": {"type": "integer", "minimum": 1}
          }
        },
        "baseline_runs": {
          "description": "오탐이 잦은 검사(untested_contract_item · out_of_contract)를 warn_only 로 두는 기간. 원장이 본 런 수로 센다.",
          "type": "integer", "minimum": 0
        }
      }
    },
    "external_pr_review": {
      "type": "object",
      "additionalProperties": false,
      "properties": {
        "enabled": {"type": "boolean"},
        "bot_logins": {"type": "array", "items": {"type": "string"}},
        "poll_sec": {"type": "integer", "minimum": 1},
        "timeout_sec": {"type": "integer", "minimum": 1}
      }
    },
    "cross_verify": {
      "description": "01-plan 의 외부 교차검증기. 부재하면 폴백 에이전트로 대체하고, 둘 다 불가하면 02 를 스킵하되 등급 PASS_WITH_GAPS 로 드러낸다 — 조용히 통과가 아니다.",
      "type": "object",
      "additionalProperties": false,
      "properties": {
        "required": {
          "description": "참이면 primary·fallback 이 둘 다 불가할 때 진행하지 않는다.",
          "type": "boolean"
        },
        "primary": {
          "description": "외부 교차검증기의 도구 식별자. null 이면 폴백만 쓴다.",
          "type": ["string", "null"]
        },
        "fallback": {
          "description": "폴백으로 쓸 서브에이전트 이름. null 이면 폴백이 없다.",
          "type": ["string", "null"]
        }
      }
    },
    "background_threshold_sec": {
      "description": "전체 회귀를 백그라운드로 돌릴 기준. 상수가 아니라 calibration.full.sec 과 비교하는 임계값이다.",
      "type": "integer",
      "minimum": 0
    },
    "calibration_file": {"type": "string"}
  },
  "definitions": {
    "role": {
      "type": "object",
      "required": ["id", "agent", "code", "owns"],
      "additionalProperties": false,
      "properties": {
        "id": {"type": "string", "pattern": "^[a-z][a-z0-9-]*$"},
        "agent": {"type": "string"},
        "code": {
          "description": "경로·보고서에 쓰는 축약 코드. 경로 240자 상한 때문에 짧게 유지한다.",
          "type": "string",
          "pattern": "^[a-z][a-z0-9]{0,7}$"
        },
        "owns": {"type": "array", "minItems": 1, "items": {"type": "string"}},
        "excludes": {"type": "array", "items": {"type": "string"}}
      }
    }
  }
}
